{
  "$schema": "../../../docs/slice.manifest.schema.json",
  "name": "midtrans-payment",
  "version": "0.1.0",
  "description": "Midtrans Snap checkout + webhook handler + transaction history. Provider-isolated under components/providers/midtrans + actions/midtrans so Doku/Stripe land as siblings without API churn.",
  "category": "commerce",
  "stability": "beta",
  "deps": {
    "shared": [],
    "slices": ["convex-auth"],
    "convexFeatures": ["payment"],
    "npm": {
      "midtrans-client": "^1.4.2"
    },
    "env": [
      {
        "name": "MIDTRANS_SERVER_KEY",
        "required": true,
        "scope": "server",
        "description": "Midtrans Server Key (HMAC signing + Snap API calls)."
      },
      {
        "name": "MIDTRANS_CLIENT_KEY",
        "required": true,
        "scope": "public",
        "description": "Midtrans Client Key exposed to browser for Snap.js init."
      },
      {
        "name": "MIDTRANS_IS_PRODUCTION",
        "required": false,
        "scope": "server",
        "description": "true|false; defaults false (sandbox)."
      }
    ]
  },
  "files": {
    "include": ["**/*"],
    "exclude": ["*.test.ts", "*.test.tsx", "*.spec.ts"]
  },
  "convexFiles": {
    "include": ["**/*.ts"],
    "exclude": ["*.test.ts"]
  },
  "permissions": [
    "payment.create-order",
    "payment.view-order",
    "payment.cancel-order",
    "payment.refund",
    "payment.webhook-process"
  ],
  "schemaTables": [
    {
      "name": "midtrans_payment_orders",
      "namespaced": true,
      "indexes": ["by_workspace", "by_workspace_user", "by_workspace_orderId", "by_workspace_status_createdAt"]
    },
    {
      "name": "midtrans_payment_webhook_events",
      "namespaced": true,
      "indexes": ["by_workspace_received", "by_workspace_request"]
    }
  ],
  "compatibility": {
    "next": ">=15 <17",
    "react": "^19",
    "convex": "^1.36",
    "tailwind": "4",
    "auth": "convex-auth"
  },
  "tags": ["payment", "commerce", "midtrans", "indonesia", "snap", "qris", "webhook"],
  "notes": "Existing `convex/features/payment/schema.ts` declares shared `paymentOrders`/`paymentWebhookEvents` across midtrans + doku — collides with 2026-05-12 namespace decision. Manifest captures target namespaced state; schema migration tracked in Operator Backlog. Snap.js loaded client-side via MIDTRANS_CLIENT_KEY; webhook verification uses MIDTRANS_SERVER_KEY HMAC."
}
