{
  "$schema": "../../../docs/slice.manifest.schema.json",
  "name": "dashboard-shell",
  "version": "1.3.0",
  "description": "One responsive dashboard chrome: React/Next remains the default shadcn rail/topbar/dock/tile-drawer distribution; explicit SvelteKit gets native Svelte 5 surfaces over the same portable nav core.",
  "category": "ui",
  "stability": "stable",
  "deps": {
    "shared": [],
    "slices": [],
    "convexFeatures": [],
    "npm": {
      "lucide-react": "^0.400.0",
      "vaul": "^1.0.0"
    }
  },
  "files": {
    "include": [
      "**/*"
    ],
    "exclude": [
      "*.test.ts",
      "*.test.tsx"
    ]
  },
  "compatibility": {
    "next": ">=14 <17",
    "react": "^18 || ^19",
    "tailwind": "3||4",
    "auth": "any"
  },
  "tags": [
    "ui",
    "layout",
    "dashboard",
    "sidebar",
    "dock",
    "responsive",
    "shell"
  ],
  "notes": "React default needs shadcn sidebar + drawer. Explicit SvelteKit uses native CSS/runes/$app/state and shares only config + nav/core types; no shadcn, Lucide, Vaul, Convex, env, or localStorage."
}
