{
  "$schema": "../../../docs/slice.manifest.schema.json",
  "name": "user-management",
  "version": "0.8.0",
  "description": "Dual-framework members/invites/roles/teams/access administration with one permission-gated Convex backend. React/Next is default; SvelteKit installs the native Svelte renderer and shared framework-neutral cores.",
  "category": "auth",
  "stability": "experimental",
  "deps": {
    "shared": [],
    "slices": [
      "rbac-roles",
      "convex-auth"
    ],
    "convexFeatures": [
      "user-management",
      "rbac-roles"
    ],
    "npm": {
      "lucide-react": "^0.400.0"
    },
    "env": []
  },
  "files": {
    "include": [
      "**/*"
    ],
    "exclude": [
      "*.test.ts",
      "*.test.tsx"
    ]
  },
  "convexFiles": {
    "include": [
      "**/*.ts"
    ],
    "exclude": [
      "*.test.ts"
    ]
  },
  "permissions": [
    "members.view",
    "members.manage",
    "members.invite",
    "roles.view",
    "roles.manage"
  ],
  "schemaTables": [
    {
      "name": "um_members",
      "namespaced": true,
      "indexes": [
        "by_tenant",
        "by_tenant_user",
        "by_user"
      ]
    },
    {
      "name": "um_invites",
      "namespaced": true,
      "indexes": [
        "by_tenant",
        "by_tenant_status",
        "by_email",
        "by_token"
      ]
    },
    {
      "name": "um_teams",
      "namespaced": true,
      "indexes": [
        "by_tenant"
      ]
    },
    {
      "name": "um_team_members",
      "namespaced": true,
      "indexes": [
        "by_team",
        "by_team_user"
      ]
    },
    {
      "name": "um_tenant_links",
      "namespaced": true,
      "indexes": [
        "by_parent",
        "by_child"
      ]
    }
  ],
  "compatibility": {
    "next": ">=15 <17",
    "react": "^19",
    "convex": "^1.36",
    "tailwind": "4",
    "auth": "convex-auth"
  },
  "tags": [
    "user-management",
    "members",
    "rbac",
    "auth",
    "team",
    "admin",
    "convex",
    "no-clerk"
  ],
  "notes": "0.8.0 (2026-09-15): native Svelte 5/SvelteKit distribution over shared permission, members-view and tool cores; React remains default. Corrects the canonical Convex backend path to convex/features/user_management and declares the existing lucide-react dependency. 0.6.0 (2026-05-31): P4c \u2014 cross-tenant AccessMatrix (users \u00d7 tenants grid, inline role assign; convex hierarchy/getAccessMatrix walks root + descendants). Completes the superspace-parity epic. 0.5.0: P4b \u2014 tenant hierarchy + propagating invites. Generic um_tenant_links edge tree (rr never owns the tenant entities). convex/features/user-management/hierarchy/{query,mutation}: linkTenant/unlinkTenant + sendHierarchyInvite (same | decreasing role strategy, BFS descendants) + listChildTenants/getDescendantTenants. InviteDialog gains an optional propagate toggle (allowPropagate prop). 0.4.0: P4a \u2014 teams (um_teams + um_team_members; TeamsPanel + TeamDetail; createTeam/removeTeam/addTeamMember/removeTeamMember + listTeams, gated members.manage). UserManagementPanel gains an optional Teams tab. 0.3.0: P3 \u2014 roles admin (UserManagementPanel tabs; RolesPanel + RoleEditor + RolePermissionGrid create/edit/delete custom roles, system roles read-only). Roles CRUD reuses rbac-roles' listRoles/upsertRole/removeRole \u2014 no new convex here. 0.2.0: invite flow (um_invites). 0.1.0: members table. RBAC-agnostic by design \u2014 the slice imports no other slice's frontend; roles + resolved permissions + permission catalog are passed as props (wire from rbac-roles at the app level). Full-parity extras (P4: hierarchy/teams/access-matrix) follow."
}
