{
  "$schema": "../../../docs/slice.manifest.schema.json",
  "name": "rbac-roles",
  "version": "0.4.0",
  "description": "RBAC engine ported from superspace: 6 system role presets (owner/admin/manager/staff/client/guest), dot-namespaced permissions with `*` / `feature.*` matching, pure check helpers, and props-driven UI primitives (PermissionGate, usePermissions, RoleBadge, PermissionMatrix). Convex template ships a tenant-scoped rbac_roles table + checkPermission / requirePermission + seedSystemRoles.",
  "category": "auth",
  "stability": "beta",
  "deps": {
    "shared": [],
    "slices": [],
    "convexFeatures": [
      "rbac-roles"
    ],
    "npm": {},
    "env": [
      {
        "name": "PLATFORM_ADMIN_EMAILS",
        "required": false,
        "scope": "server",
        "description": "Comma-separated emails granted cross-tenant superadmin (`*`)."
      }
    ]
  },
  "files": {
    "include": [
      "**/*"
    ],
    "exclude": [
      "*.test.ts",
      "*.test.tsx"
    ]
  },
  "convexFiles": {
    "include": [
      "**/*.ts"
    ],
    "exclude": [
      "*.test.ts"
    ]
  },
  "permissions": [
    "roles.view",
    "roles.manage"
  ],
  "schemaTables": [
    {
      "name": "rbac_roles",
      "namespaced": true,
      "indexes": [
        "by_tenant",
        "by_tenant_slug"
      ]
    }
  ],
  "compatibility": {
    "next": ">=15 <17",
    "react": "^19",
    "convex": "^1.36",
    "tailwind": "4",
    "auth": "convex-auth"
  },
  "tags": [
    "rbac",
    "auth",
    "permissions",
    "roles",
    "authorization",
    "no-clerk",
    "convex"
  ],
  "notes": "0.2.0 (2026-05-31): real engine landed (was a config-only stub). Split design — this is the engine; the members/invites/roles-admin UI lives in the user-management slice (peers this). Ported from superspace convex/workspace/{permissions,roles.config} + convex/lib/rbac. Generic tenantId (not workspace-locked). Pure + props-driven."
}
