{
  "$schema": "../../../docs/slice.manifest.schema.json",
  "name": "broadcast-channel-sync",
  "version": "0.3.0",
  "description": "Cross-tab + cross-iframe state sync using BroadcastChannel with a same-origin localStorage/storage-event fallback. React hook default; additive Svelte store distribution.",
  "category": "misc",
  "stability": "beta",
  "deps": {
    "shared": [],
    "slices": [],
    "convexFeatures": [],
    "npm": {},
    "env": []
  },
  "files": {
    "include": [
      "**/*"
    ],
    "exclude": [
      "*.test.ts",
      "*.test.tsx",
      "*.spec.ts"
    ]
  },
  "permissions": [],
  "schemaTables": [],
  "compatibility": {
    "next": ">=15 <17",
    "react": "^19",
    "convex": "any",
    "tailwind": "4",
    "auth": "any"
  },
  "tags": [
    "realtime",
    "cross-tab",
    "broadcast-channel",
    "frontend-only"
  ],
  "notes": "Pure-browser slice with SSR-safe lazy transport. BroadcastChannel is preferred; localStorage/storage events are the fallback. Explicit Svelte installs use the additive store distribution."
}
