{
  "$schema": "../../../docs/slice.manifest.schema.json",
  "name": "mdx-blog",
  "version": "0.1.0",
  "description": "File-based MDX blog under content/blog/*.mdx. List + detail page + RSS feed. No backend.",
  "category": "content",
  "stability": "stable",
  "deps": {
    "shared": [],
    "slices": [],
    "convexFeatures": [],
    "npm": {
      "@next/mdx": "^16.0.0",
      "gray-matter": "^4.0.3",
      "rehype-pretty-code": "^0.14.0",
      "@mdx-js/loader": "^3.0.0",
      "@mdx-js/react": "^3.0.0"
    }
  },
  "files": {
    "include": ["**/*"],
    "exclude": ["*.test.ts", "*.test.tsx"]
  },
  "compatibility": {
    "next": ">=15 <17",
    "react": "^19",
    "tailwind": "3||4",
    "auth": "any"
  },
  "hooks": {
    "postInstall": [
      "echo 'Create content/blog/ folder. Drop *.mdx files with frontmatter (title, date, slug).'",
      "echo 'Configure next.config.mjs withMDX wrapper.'"
    ]
  },
  "tags": ["content", "blog", "mdx", "static", "ssg"],
  "notes": "Static file-based — zero database. Frontmatter parsed via gray-matter. Syntax highlighting via rehype-pretty-code (Shiki). RSS feed at /rss.xml. List view auto-sorts by frontmatter.date desc."
}
